{"components":[{"abi":null,"deadline":{"unit":"ms","value":"100"},"external":false,"golden":[],"id":"Sink","implementation":{"kind":"invar","link":"static","target":"consume"},"isolation":"in-process","license":{"expression":"MIT","link":null},"lifecycle":null,"name":"Sink","params":{},"ports":[{"direction":"in","latency":null,"layout":null,"name":"distance","optional":false,"rate":{"unit":"Hz","value":"5"},"type":"Quantity<i32,m>"},{"direction":"in","latency":null,"layout":null,"name":"vector","optional":false,"rate":{"unit":"Hz","value":"10"},"type":"std::robotics::Vector3<f64,mm,world>"}],"properties":[],"resources":{"cpu_cores":{"unit":"one","value":"1"}},"shim":null,"wcet":{"unit":"ms","value":"2"}},{"abi":null,"deadline":{"unit":"ms","value":"100"},"external":false,"golden":[],"id":"Source","implementation":{"kind":"extern","link":"manifest","target":"source_manifest"},"isolation":"separate-process","license":{"expression":"Apache-2.0","link":null},"lifecycle":null,"name":"Source","params":{"gain":{"unit":"one","value":"1.5"},"max_velocity":{"unit":"rad/s","value":"1.5"}},"ports":[{"direction":"out","latency":null,"layout":null,"name":"distance","optional":false,"rate":{"unit":"Hz","value":"5"},"type":"Quantity<i32,m>"},{"direction":"out","latency":{"unit":"ms","value":"2"},"layout":null,"name":"vector","optional":false,"rate":{"unit":"Hz","value":"10"},"type":"std::robotics::Vector3<f64,mm,world>"}],"properties":[],"resources":{"cpu_cores":{"unit":"one","value":"1"},"gpu_memory":{"unit":"GiB","value":"2"},"memory":{"unit":"MiB","value":"512"}},"shim":null,"wcet":{"unit":"ms","value":"3"}}],"connections":[{"id":"source.distance->sink.distance","policy":"sample-and-hold","source":"source.distance","target":"sink.distance"},{"id":"source.vector->sink.vector","policy":"queue(4)","source":"source.vector","target":"sink.vector"}],"extern_components":[{"abi":{"kind":"c","prefix":"source_"},"deadline":null,"external":true,"golden":["source-vector"],"id":"source_manifest","implementation":null,"isolation":"separate-process","license":{"expression":"Apache-2.0","link":"process"},"lifecycle":["init","configure","step","shutdown"],"name":"source_manifest","params":{},"ports":[{"direction":"out","latency":null,"layout":"invar_vector3","name":"vector","optional":false,"rate":{"unit":"Hz","value":"10"},"type":"std::robotics::Vector3<f64,mm,world>"}],"properties":["finite-vector"],"resources":{"cpu_cores":{"unit":"one","value":"1"}},"shim":"source_shim.c","wcet":null}],"flows":[{"id":"sensing","name":"sensing","ports":["source.vector","sink.vector"],"within":{"unit":"ms","value":"120"}}],"frames":[{"id":"base","name":"base","parent":"world"},{"id":"world","name":"world","parent":null}],"products":[{"capacity":{"bus.ethercat":{"unit":"Mbit/s","value":"100"},"cpu_cores":{"unit":"one","value":"8"},"gpu_memory":{"unit":"GiB","value":"24"},"memory":{"unit":"GiB","value":"16"}},"commercial":true,"distribution":"proprietary-binary","id":"SimCell","name":"SimCell","robot":"menagerie::franka_emika_panda"}],"schema":"invar-system-v1","system":{"id":"cell","instances":[{"component":"Sink","id":"cell::sink","name":"sink"},{"component":"Source","id":"cell::source","name":"source"}],"name":"cell","product":"SimCell"},"version":1}
